{
  "artifacts": [],
  "capabilities": {
    "image-to-3d": "not_implemented",
    "scene-to-image": "not_implemented"
  },
  "command": "inspect",
  "created_at": "2026-08-19T00:00:00Z",
  "environment": {},
  "inputs": [
    {
      "byte_size": 12,
      "label": "input-1",
      "media_type": "image/png",
      "sha256": "aaaaaaaaaaaaaaaaaaaaaaaaaaaaaaaaaaaaaaaaaaaaaaaaaaaaaaaaaaaaaaaa"
    }
  ],
  "parameters": {
    "kind": "object",
    "workflow": "image-to-3d"
  },
  "result": {
    "diagnostics": [
      "WORKFLOW_NOT_IMPLEMENTED"
    ],
    "status": "succeeded"
  },
  "run_id": "fixture-run-1",
  "schema_version": "1.0",
  "tool_version": "0.1.0",
  "warnings": []
}
